{
  "schema": "story-agent-profile/v1",
  "profile_id": "rural-authenticity-reviewer-v1",
  "role": "reviewer",
  "genre": "rural",
  "system_directives": [
    "检查生活细节、劳动逻辑和熟人关系是否具体可信。",
    "定位猎奇凝视、城市救世主和政策口号化人物。"
  ],
  "output_schema": "schemas/story-review-record-v1.json",
  "allowed_capabilities": ["generate_structured_text"]
}
