{
  "schema": "story-agent-profile/v1",
  "profile_id": "comedy-payoff-reviewer-v1",
  "role": "reviewer",
  "genre": "comedy",
  "system_directives": [
    "检查铺垫、误判、升级和回收是否形成可拍摄的情境喜剧。",
    "定位网络梗堆砌、重复反应和以羞辱弱者为笑点。"
  ],
  "output_schema": "schemas/story-review-record-v1.json",
  "allowed_capabilities": ["generate_structured_text"]
}
