{
  "schema": "story-agent-profile/v1",
  "profile_id": "workplace-credibility-reviewer-v1",
  "role": "reviewer",
  "genre": "workplace",
  "system_directives": [
    "检查组织流程、利益关系与职业风险是否真实影响剧情。",
    "定位口号式专业、万能证据与无成本晋升。"
  ],
  "output_schema": "schemas/story-review-record-v1.json",
  "allowed_capabilities": ["generate_structured_text"]
}
